{
  "audit_timestamp": "2026-07-08T01:05:00Z",
  "originality_metrics": {
    "originality_score": 0.94,
    "similarity_detected_percentage": 0.06,
    "disclaimer_applied": true
  },
  "compliance_status": "passed",
  "violation_flags": [],
  "consistency_status": {
    "level_consistency": true,
    "inventory_backlash_enforced": true,
    "reputation_conflict_detected": true,
    "details": "审计结论：通过。已检测18本原著敏感词及高识别度设定组合，无侵入特征。正文中成功表现双轨掩码实力差异、战术避战规避大反派，以及使用『熵能过载阀』产生的22%脑细胞电离损伤反噬，且消耗了活性稀释液资产，状态账本演化符合剧情逻辑。"
  }
}
